{
  "zoomMode": 0,
  "defaultZoomLevel": 10,
  "useScroll": true,
  "buttonBgSize": 200,
  "buttonIconSize": 150,
  "buttonX": 850,
  "buttonY": 600,
  "buttonIconOpacity": 0.5,
  "buttonBgOpacity": 0.5,
  "keybind": "",
  "cinematicCamera": true,
  "smoothing": true,
  "smoothness": 7,
  "cinematicBars": true,
  "cinematicBarHeight": 0.2,
  "cinematicBarColor": "#000000",
  "showZoomLevel": true,
  "lowSensitivity": true,
  "lowSensitivityStrength": 0.75,
  "animationSpeed": 0.3,
  "saveZoomLevel": true,
  "zoomSensitivity": 10,
  "alwaysAnimate": true,
  "hideHand": true,
  "zoomSound": true,
  "zoomSoundVolume": 1.0,
  "hideHud": false,
  "disableAnimation": false,
  "showZoomButton": true
}
